{
  "$schema": "https://raw.githubusercontent.com/wilanis/wilanis-js/main/packages/core/schemas/trigger-kind.schema.json",
  "label": "HTTP route",
  "description": "A route. The body is decoded by the consumes codec into context.body (typed by settings.body); query, route placeholders (context.params, each one required), headers and cookies are in the context too, and the guarding plugin adds the caller it identified (context.principal, context.session, context.challenge) for triggers whose policy attachments give it a credential. The trigger's input mapping picks what the graph gets; the trigger's policies decide before the graph runs; the answer is encoded by the produces codec with the status the response block chooses, and sets the cookies response.cookies takes from it. A refusal (a graph ending on purpose with a reason, a policy denying, the guard refusing a credential) is answered as { reason, message } plus what it carries, with the status response.refusals maps that reason to; every reason the route can reach must be mapped (T005). A fault (a node that broke and no switch caught, or a run blocked on a root nothing supplied) is answered 500 { error: 'fault', run } with the run's id and nothing of what broke; the log and the trace say that. A run past its deadline (deadlineMs) is cancelled and answered 504, and a body past its bound (maxBodyBytes) is answered 413; either is the route's own setting, else the plugin's.",
  "settings": {
    "fields": {
      "route": {
        "type": "string",
        "binds": "$Params",
        "description": "e.g. /tasks or /tasks/{id}; each {name} is a required context.params.name"
      },
      "method": {
        "type": "string",
        "enum": [
          "GET",
          "POST",
          "PUT",
          "PATCH",
          "DELETE",
          "HEAD",
          "OPTIONS"
        ]
      },
      "consumes": {
        "type": "string",
        "required": false,
        "description": "the body's content type; must be in the plugin's codecs table"
      },
      "produces": {
        "type": "string",
        "required": false,
        "description": "the answer's content type; must be in the codecs table. Default application/json"
      },
      "body": {
        "type": "type",
        "binds": "$Body",
        "required": false,
        "description": "the edge type of the decoded body (context.body); declaring it means a body is expected, so a request without one is a 400. Absent: the body is the trigger's in"
      },
      "deadlineMs": {
        "type": "number",
        "required": false,
        "description": "the most this route's run may take, in milliseconds, from firing to answer; past it the run is cancelled and answered 504; at most 2147483647, the longest a Node timer waits. Absent: the plugin's setting, else none"
      },
      "maxBodyBytes": {
        "type": "number",
        "required": false,
        "description": "the most a body may weigh; past it the request is answered 413 before the codec finishes. Absent: the plugin's setting, else none"
      },
      "response": {
        "type": {
          "fields": {
            "status": {
              "type": {
                "fields": {
                  "from": {
                    "type": "string",
                    "required": false,
                    "description": "a path into the answer whose value picks the status"
                  },
                  "map": {
                    "type": {
                      "fields": {},
                      "open": "number"
                    },
                    "required": false
                  },
                  "default": {
                    "type": "number",
                    "required": false
                  }
                }
              },
              "required": false,
              "description": "the status of an answer: from a path into it through map, else default (200)"
            },
            "refusals": {
              "type": {
                "fields": {},
                "open": "number"
              },
              "required": false,
              "description": "reason -> status: how each refusal the route can reach is answered, e.g. { \"missing\": 404, \"upstream\": 502 }. The body is { reason, message }. A reason this table does not map is answered as a fault, and the log names the reason; T005 makes it unreachable except across a reload."
            },
            "cookies": {
              "type": {
                "fields": {},
                "open": "@http/Cookie.shape.json"
              },
              "required": false,
              "description": "cookie name -> what it takes from the answer and how it is set: { \"session\": { \"from\": \"accessToken\", \"omit\": true, \"httpOnly\": true, \"maxAge\": 900 } }"
            }
          }
        },
        "required": false,
        "description": "how the route answers: the status of an answer, one status per refusal reason, and the cookies it sets"
      }
    }
  },
  "context": {
    "fields": {
      "method": {
        "type": "string"
      },
      "path": {
        "type": "string"
      },
      "headers": {
        "type": {
          "fields": {},
          "open": "string"
        },
        "secret": true,
        "description": "lower-cased names; secret, since a credential rides here (authorization, an api key, the cookie header): the run reads the values, and every report and trace shows the map as the marker"
      },
      "cookies": {
        "type": {
          "fields": {},
          "open": "string"
        },
        "secret": true,
        "description": "the request's cookies by name, from the cookie header; secret, since a session cookie is a bearer token"
      },
      "query": {
        "type": {
          "fields": {},
          "open": "string"
        }
      },
      "params": {
        "type": "$Params",
        "description": "the route's placeholders, each a string the route guarantees"
      },
      "body": {
        "type": "$Body",
        "description": "present whenever settings.body is declared"
      }
    }
  },
  "correlation": "headers.traceparent",
  "refusals": "response.refusals"
}
